Cell Type,Genes
Astro,"PLEKHA7, ATP6AP1L, DIO2, PCDHGA6, RHOB, PDE7B, SLC2A12, AQP41, SLC25A33, ABCC11, CARMIL1, DCUN1D1, AC004004.2, LDHAL6EP, RNF170, C1ORF61, MTHFD1, ALDOC, GABRG1, WNT7B, POU3F2, RASSF4, ABLIM1, DAG1, AC013267.1, RN7SL582P, RP11-15A1.3, RP11-510I21.1, PEX11A, ANKRD35, NEK6, C17ORF70, SSPN, CABLES1, EFHC1, LRP4, PRDX6, RP11-85O21.5, ATP13A5, IDH2, RP3-414A15.12, PTGDS6, AHCYL2, ZFP2, RP11-131L23.2, EFEMP1, LINC00886, RP1-167O22.1, CPE, RP11-5P4.1, ANKDD1A, ZNF717, OPHN1, SRPX, PTPRA, ZBTB20, TMEM164, WIF1, FIRRE, FUT9, RP11-390P2.4, PHACTR3, TTYH1, NDRG2, DHRS4-AS1, GRAMD3, ACSL62, ASTN1, MAST4, FAM168A, RP11-320H14.1, AD000092.3, GPR171, RP11-630A13.4, DDAH1, FEZF1-AS1, TMEM132A, NAV2, RP11-806K15.1, SARDH, PARD3B, AC012456.3, C2ORF82, DST3, DNAAF5, FOS, CTH, ARHGAP5, LETM1, CDH2, AC010975.2, SSPO, GFAP1, IQCH, SLC7A11-AS1, MGST1, NEAT1, SON, NKAIN4, PHEX, BMPR1A, MALAT13, GJB2, RP11-420A23.1, AMT, ACO2, CRB1, KATNAL2, SDC4, SUCLG2-AS1, ARHGEF26-AS1, ACACB, GJA1, RP4-631H13.6, ELOVL2-AS1, PRKCA, LINC00899, TRIL, MKLN1-AS, GLI1, AC005197.2, AQP4, RP11-354M20.3, CLU3, CTB-50L17.14, RAMP1, PCDHGA12, PPP1R3C, ALDH1L1, PARP3, FGF2, ACBD7, RP11-57H12.3, PSMG3-AS1, RP11-563J2.2, AC016716.1, DOLK, RORB, ID2-AS1, FYN, NAT8L, MACF1, PTGDS7, LPAR3, METRN, ZFYVE21, ZNF404, CERS1, TMPRSS3, HSP90AA14, TMEM150C, FMN2, USP40, SLC46A1, AC008957.2, LGI4, DCXR, RP4-683L5.1, PLCD4, GS1-39E22.2, LIFR, NTM4, ZFP36L11, CAPN2, CACNB1, RPS6KA2, SOX9-AS1, MT3, PCDHB4, OTX1, SAT1, PSD3, AEBP1, APC1, COL28A1, FLJ30679, TMEM241, GABBR1, MFAP5, CLU, LINC01158, ADAM20P1, SNTA1, PTN, ALG1L9P, GGACT, RP11-90E5.1, EYA2, CDHR3, ARL6IP6, PHF21B, GCDH, ACSS1, MASP1, WI2-1896O14.1, RP11-598O12.1, NPFFR1, DPYSL3, RYR32, RP11-424M22.3, MACF13, TCTN1, UFL1-AS1, SLC1A4, MT1G, EFHC2, RP11-167H9.3, HRNR, TMED8, CTD-2353F22.1, RP11-218C14.8, RP11-577N1.1, TPD52L1, PTPRZ11, KIAA0319, PCDHGA9, PHLPP1, CHRDL1, PNPLA7, ERLIN2, CEP350, TST, LINC00900, LINC00461, NINL, RALGAPA2, MLC1, CCNJL, FGFR31, AC025811.3, ERBB2, SRGNP1, LGI41, RNA28S51, HAP1, RP4-673D20.6, RHPN2, WDR49, FAM184A, PRODH, ATP13A4, ZNF209P, PTCHD1, ADORA2B, RIMKLBP2, RYR31, COLCA2, ACSBG1, RPS12P26, ETNPPL, COPS7B, ZNF221, PHGDH, MAP3K5, SLC4A4, MAPK4, DGKG, ADHFE1, IQCA1, HOPX, SLC25A43, FAT3, RP11-106M7.1, TSHZ1, PLXNB1, RAB34, CA12, PPAP2B, CKB2, NNT-AS1, MT31, ITPKB, MACF12, SLC39A11, DPY19L3, ZFP36L1, TTYH11, CTC-498M16.4, SLC25A20, DIAPH3, STOX1, AGFG2, LINC00271, AC114877.3, NTRK2, ZBTB201, LINC00498, TMEM47, SLC2A10, PLTP, WDR60, RN7SL297P, RP11-437J2.4, AC002429.2, ANGPTL4, PAX6, GREB1, OLAH, SLC38A1, ELOVL2, DBI, SLC14A1, BAZ2B5, COL5A3, AC074363.1, CSGALNACT1, CCDC163P, EEF2K, EVC2, AIFM3, TOM1L2, PBXIP1, SUOX, SLC13A5, PAPLN, BNIP3P33, FGFRL1, NRG3, EMX2, ARSJ, RP11-528A10.1, LINC00391, IL17RB, GPC5-AS1, RP1-197B17.7, LRAT, ATP1B2, LPIN1, SESN3, AK4, EPHB1, MTM1, AC012370.3, F3, SLC35F1, TNNT1, GPR56, LGI1, KIAA0195, AC008067.2, Astro, RGS9, FAT1, MIR920, SAT11, LINC00299, XRCC6P4, DOCK7, PON3, TMEM56, PPP1R3D, CST31, SLC27A1, GAREML, ACSL61, ZNF81, LINC01114, RNU6-697P, BCO1, SCARA3, HADHB, SLC1A21, MRO, VWA3A, ERBB4, RP11-617F23.1, FAM118B, ITGA7, LMO3, LINC00298, DPP8, NBPF10, QKI, RND1, HIF3A1, PYGM, SLC25A181, ETNPPL1, FGGY, RP4-673D20.3, RP11-245J24.1, RP11-52A20.2, LDHD, GPAM, ADA, AC090625.1, ANKFN1, CMBL, HGF, ABLIM11, SLC1A31, BMPR1B, ADD32, RNF182, CLU2, NWD1, LANCL2, BOC, MSI2, EHHADH, RP11-147L13.15, HSD17B6, RP5-968J1.1, NBPF19, FUT10, POLL, PIK3C2A, RP1-93H18.1, SIRPA, ME1, ARHGAP5-AS1, RP11-109I13.2, PLOD2, FNBP1, PCDHGC3, AC099754.1, RP11-517I3.2, CTA-243E7.1, HSPB1, TMEM229A, AHNAK, UG0898H09, PAMR1, ZFHX4, RP11-185E8.2, SDC3, NBPF26, FBXO2, LAMA1, HIF3A, SYCP2, MOXD1, PRDM16, RGMA, SLC7A2, PTPN9, KIAA1161, OXTR, GSTM5, LINC01351, GNG12-AS1, MEIS2, VAC14-AS1, ACAA2, RP11-229D13.3, PCDHGA3, GPC5-AS2, PLCD1, TNS3, ACSF2, CKB, LINC00500, ADCYAP1R1, MSI21, SOX5, CXCL5, TRIM66, SIRPB3P, RP5-858L17.1, DCHS2, PMP2, CYBRD1, BMP7, SPARCL1, RP11-319G9.1, RP11-384F7.2, LIX1, MRAS, TM9SF4, ZNF516, RP11-39M21.1, RP11-119F7.5, MYOM1, ALDH2, NACC2, PTPRF, NT5E, RP1-5O6.6, RP11-139K1.2, MTSS1L, CTAGE14P, TTPA, FGFR3, NEAT15, PAXIP1-AS2, RP11-116O18.3, NTM3, NCAN, MT-RNR24, ID3, RP11-574K11.8, COLCA1, PLIN5, NHSL1, AC016907.3, RMST, TET1, FJX1, DST2, LINC00982, FEZF2, NEK1, MGC16275, FSIP2, SLC44A2, PTGDS, ACP6, INTU1, NFIB, ZSWIM6, TNC, RP1-68D18.3, LSAMP1, HES1, LCTL, ATP13A4-AS1, ABCD2, ZBTB7C, MOK, CLPTM1, FERMT2, NTNG2, JUNB, AC011747.4, HHIPL1, TTC30A, ZNRF3, GPR87, GPR98, TPP1, SLC7A11, NBPF101, APC, EPHX1, RP11-504P24.8, KIAA1671, ASAP2, ZNF680, RP11-275H4.1, TGFBR3, HPR, RP11-226L15.5, CHPT1, C16ORF89, C14ORF159, PARD3, GPR143, SCN11A, DTNA1, CYP1D1P, DPP10, MRVI1, ZNF816, DHODH, IGSF1, FBXL7, LINC01422, CDH20, HADHAP1, RGR, NADK2, APEH, B3GALT5, RP11-489D6.2, RLBP1, RPL7L1P8, MAML2, TRDN, VANGL2, JUN, STK33, TEX15, OSBPL2, LYPLAL1-AS1, SCRG1, LINC01314, ENTPD2, RP11-651K21.1, GPM6A, CAMK2G1, PPP1R26, GPM6B, LINC00943, RFX2, CYP7B1, SRGAP3, CHRNB1, ACKR3, RP11-360N9.2, TP53BP2, FAM182A, FUT91, OAF, SMOX, ADD3-AS1, BBOX1, BBS2, LINC01532, AC002429.5, DTNA, PPP2R5A, APOE1, SCG3, PCDHGA2, PRDM5, BAZ2B, C20ORF194, NBPF9, HEPH, RP11-317N12.1, IL9, RNY3P3, TLCD1, SFXN5, TMEM220, RP11-437J2.3, GLIS3, TOX, CACNB2, AGBL2, LFNG, AP000462.1, AC009120.4, GPRC5B, DMGDH, COL5A31, WBP2NL, RP11-426D19.1, AADAT, GLI3, SPARCL15, CYP51A1P3, PEX12, SLCO1C1, ITSN1, ZNF671, DOCK4, RRS1-AS1, RP11-298I3.1, GLUL, ITGA71, ZFAND5, ACADVL, GOLGA2P5, INTU, ENO1, ASPH, RP11-26J3.1, CASC10, SLC35C2, DNAH7, ARHGAP32, NTSR2, GRIN2C, EMX2OS, PCDHGA4, INHBB, CNTNAP3, ACSS11, RFX4, NDP, GBA, PPIAP19, HSPA1A, SHROOM3, PFKM, ADAMTSL5, GABRB1, SORBS1, FAM107A, SPARCL16, ACOT11, PTAR1, EPHX2, ADD31, LINC00595, RP11-120J1.1, RP11-806O11.1, RPS16P5, ANO8, KCNN3, MRPL35P1, BBS4, LRP1, BAZ2B4, LHX2, RBM26-AS1, ARHGEF4, RP11-679C8.2, RP11-582J16.4, HPS4, SLC39A12, CST3, MIR568, NBPF11, PLIN4, ARHGAP24, FNBP11, RP11-191H23.1, S100B, PGM1, PFKFB2, RP11-319G6.1, TNIK, SLITRK2, EYA1, RP11-577N1.2, NDUFS3, AP000462.2, RP1-155D22.2, HPSE2, GLI2, GNA14-AS1, LINC01473, RPL31P54, TRIM8, METTL7A1, GLUL1, SLC2A4, HKDC1, RYR3, MCCC2, CYP4F11, NQO1, FAM171A1, WFS1, HSBP1L1, ZNF521, EZR, SDS, GPT2, PCDHGB7, ZMYND12, PCDHGA10, PPP1R3G, AQP1, LDHB, PCDH9, C8ORF37, SLC7A10, PCSK5, PLA2G5, LINC00092, NFIA, SOX6, KLF15, THBS3, RP11-1070A24.1, DTX1, SYPL2, BNIP3P32, PHKA1, RP11-64B16.4, ACSL6, CTB-113D17.1, TOB1, SUGCT, AGL, PDLIM3, SLC18B1, MGAT4C, WDR17, ALDH4A1, RGN, RP4-625H18.2, C1ORF228, LRTOMT, RP11-3D4.4, ID2, NTRK21, GRAMD31, PPP1R1B, F8, IQCA11, GPC4, RP4-657E11.10, RNF43, KCNJ10, RHOBTB31, LRIG1, LRRC75A, RP11-495P10.10, WDFY3-AS2, CKB1, SORBS11, RP11-360N9.3, ZMAT11, CLDN12, RP11-436K8.1, MMD2, PPARA, ALDH7A1, ADD3, PTCH1, PRKD1, CLRN1-AS1, SLC30A10, LINC00499, SLC9A3R1, SLC44A3, ZFHX2, FAM227A, GAS8, KLKB1, MT2A, FZD8, CHDH, IGFN1, AQP4-AS1, ITGB4, PCDHGA5, TCF7L1-IT1, GJB6, FREM2, RPL21P32, PHYHD1, GLUD2, MROH7, ABCA7, ADI1, MICALL2, AMOT, DBP, CNTFR-AS1, WWOX, PMM1, AC016716.2, RPE65, RP11-70L8.5, ANKRD45, SLC25A53, SPON1, GPD2, PIR, CRYAB, CRYZ, IFT43, ENKUR, UBAC1, ENHO, GOLIM4, PPFIA1, PLCG1, NME9, ASAP3, RP1-253P7.4, AC072062.1, GNA14, RP11-427J23.1, IFT27, MIR99AHG, RP11-768G7.2, PRODH1, CD38, RP11-203P2.2, CYB5B, FAM167A, NRXN1, ORAI3, RP11-159K7.2, MOCS1, ZNF827, SALL2, SEC14L6, FABP5P4, CBX3P3, RP3-453C12.14, FAM107A1, YAP1, CYP2J2, NEBL, SLC14A11, AC110754.3, SYNE1, FAM213A, SLC16A9, RP11-968O1.5, CTNND2, NDUFAF6, TPCN1, EDNRB, SYCP3, CTNNA2, TKT, GAS2L1, SOX21-AS1, ARHGAP51, FAM71F2, MYO10, TRPM3, H3F3B, RP11-517I3.1, KIF24, SLC1A3, IQCH-AS1, CTC-457E21.1, FHIT, SMO, CPE1, IL33, ASRGL1, SOX9, PCDHB5, RP11-731J8.2, GPR75, RNF219-AS1, AC074391.1, CHR22-38_28785274-29006793.1, TTLL4, ROPN1B, NBPF1, HSDL2, DHTKD1, SRI, RP11-281A20.2, RP11-567G24.3, HS2ST1, KAL1, COQ10A, SLC25A29, AHCYL11, RP11-315D16.4, APOE, AHCYL1, A2ML1, ITM2C, ATP1A2, ADCY2, C1orf611, SEMA3D, AC009501.4, LINC01550, CHI3L1, LSAMP-AS1, AASS, HEPACAM, VAV3, SASH1, KNDC1, KIAA1407, TMEM136, VEGFB, DCLK2, SLC9A8, RP11-776H12.1, GPR981, CUBN, ABCA12, CTD-2266L18.1, F11-AS1, MYH15, CDH4, HHATL, ADRB1, NFATC4, MYBPC1, RP11-326C3.11, LA16C-380F5.1, VCAN, NPAS3, CADM1, TMEM9, C1ORF110, GJA11, NEAT16, ZNF98, RANBP3L, MUT, SERPINE2, ZIC5, TNIK1, FAM181B, HTRA1, LCNL1, CTC-559E9.1, OSTM1-AS1, KCTD21, SELENBP1, ZMAT1, P2RY1, CXCL3, CAT, FAM171B, PLIN1, CYP4V2, RP11-145O15.3, LINC01354, FARP1, ID4, SORCS2, BCKDHB, MRVI1-AS1, GPC5, SLC1A2, ETAA1, CNTFR, RP11-10C8.2, BRINP2, DOK5, AKR7A2, FLJ16779, ARRB1, NR2E1, AC007879.4, FAM189A2, LGR4, TUBB2B, GRAMD1C, LINC01241, FKBP10, RAPGEF3, BAI1, INTS3, AC004019.13, AC011516.2, SEMA4A, AP003025.2, THSD1, MINK1, NDRG21, RORA, SYTL4, POU2F1, RP11-768G7.1, GPR37L1, ARHGEF26, ECHDC2, BCAN, MAOB, ATP1A21, CDH26, CEP85L, C2ORF42, RNA28S5, ITPR2, SOX2, SLC6A11, ELMO2, SPARC, LRP1B, IL17D, GPR125, PRSS35, KCTD15, RP11-482D24.2, PON21, ATP1B21, PPP2R2B, RP11-39M21.2, DCT, GAPDH, ADCY8, GJA1P1, GRM3, RGS20, LSAMP, UBC, CGRRF1, PALLD, CLDN10, MST1, ACSS3, RAB30, LGR6, PTPLAD1, EFR3B, GRID1-AS1, HSPA1B, FRMPD2, PCDHGB1, TRAF3IP2, NEK11, SLC15A2, ADGRV1, LRRC43, EMID1, RP4-673D20.4, ZHX3, FADS2, NKAIN3, SEMA4B, SLC25A18, LINC01376, ACOT111, LINC00839, MKLN1, DKK3, SDC2, SLC39A12-AS1, MUL1, CTD-2353F22.2, MAPK10, CACHD1, SEC14L2, PREX2, TSC22D4, RP11-268P4.5, RP11-263K19.4, FAM198A, MLYCD, TRPS1, RP11-560I19.1, UNG, GABRA2, HRSP12, GFAP, BHMT2, MALRD1, PSD2, RPS20P33, DST, PLSCR4, TFAP2C, MUTYH, XYLT2, TULP3, TMEM72, EFNA5, GLUD1, LRRC8A, PCDHGA7, CTC-498M16.2, PON2, DSC1, DAAM2, SOX21, GDPD2, MYO6, AMZ2, METTL7A, PCDHGB8P, RNU6ATAC12P, FOXRED2, PIPOX, PITPNC1, GPR19, HERPUD2, EGFR, DECR1, STON2, PPARGC1A, PDE4DIP, APLNR, SYNE12, PTPRZ1, OGFRL1, NOTCH2, RP11-722E23.2, FXYD3, NTM, BDH2, NHS, RP11-569G13.2, FGD6, PRKG1, RP11-393I2.4, LRRC3B, PYGB, C5, C1orf61, RP5-1120P11.1, TCF7L2, ACOX2, LINC00654, MTMR1, RP11-44N22.3, CLEC16A, C2ORF72, KCNA2, RHOBTB3, NCKAP5, ROBO3, STRIP2, CASC2, SPAG92, RNU6-116P, WWC1, OLFM2, SLC25A48, RP11-436D23.1, CAMK2G, HRH1, LINC01266, AGT, LRRC16A, FKBP9, SGCD, RP11-444D3.1"
Endo,"RP11-422P24.9, ZNF257, SPARC2, OPTN, TBX2, SLC10A3, RHOB, MMRN2, RNU6-490P, CD34, RASL12, SCN4A, HIST1H1D, APH1A, IGF1R, TP63, HPCAL1, SLC19A1, GNAS4, MXRA5, TRGC1, NFKBIA, GATA2-AS1, RP11-568K15.1, ACN9, CX3CL1, COBLL1, NDUFB8P2, SYNPO, DIO3, ZFP36L14, CXCL1, ECSCR, SLC6A6, SLC16A1, CTR9, PSME2, KIRREL, RP11-693N9.2, CTNNB1, EPHA2, CKMT2, SPRY4-IT1, SERTAD1, SDPR, PLEKHG2, CDA, LMO21, AFAP1L1, SLC25A39, TMOD3, PARP14, MTUS12, CCDC501, NOC3L, GPRC5A, MT-CO32, BTN3A3, ADAR, ARL15, COL24A1, ZNF799, DDX47, IFI27, OAZ1, SH2D3C, CLIC5, PVRL2, TAGLN2, SLC16A4, ADM, SFTA1P, RP11-93B14.9, FOSB, C1ORF35, TMEM2, LINC01139, SLCO4A1, IL6ST1, SRP141, SP1001, MT-CO21, THBS1, OLFML2A, PHACTR2, AC116366.6, MYRIP, CD63, SHE, TBX15, LGALS1, OBFC1, LZTS1, MT-ND3, A2M, NTAN1, NKX6-1, FBXO25, GRB10, AC025335.1, CD248, MYLK2, C11ORF96, NEAT1, PSME1, TFPI, RP11-152C15.1, SLC9A1, MT1E, EPB41L4A, GPER1, HLA-B, STRA6, CYP1B1, ABCA9, ADH1B, CLDN5, MT-TK, RP11-253E3.3, LINC00961, RPL11, TIPARP, MYO5C, TMEM179B, ZNF366, LRRC32, CXCL11, DLC1, ST8SIA6, TFRC, VANGL1, ITIH5, POMP, MANBAL, ERG, FZD10, RHOBTB1, GALNT18, PCDH1, RBPMS2, FOXL2, MT-TV, DLL4, MT1L, RP11-649A16.1, ZNF442, GAPDH1, CNTLN, SMAGP, LSMEM1, FRZB, LAMA3, LRRC70, BHLHE40, RPL8, PK, WIPI1, SAT14, PTPRG, ANKS1A, RPL35A, MLKL, EGFL7, TBX3, RP1-283K11.3, ACKR1, LDLR, CMTM8, PIBF1, FES, FAM124B, DCN, EIF1, GPX1, APOL1, TXLNA, KIF25, FAM162B, ARPC1B, DSP, EIF2AK2, ADCY4, NID2, TPM2, DOCK9-AS1, IGFBP1, SRGN, PHLDB2, YBX3, TSC22D3, IMPDH1, CFLAR, THSD4, RP3-365O12.2, MYADM, SERPINB6, C1ORF54, CTGF, ADIPOR2, BIRC3, AXIN2, RP11-466F5.6, LUM, AC005753.1, ABLIM12, SERF2, ALDH1A2, LMNTD1, SPTBN1, CSF3, IGFBP4, CTGF1, ARHGEF15, KL, CH507-9B2.3, TUBD1, HIST1H2BC, TCN2, COL27A1, DIO3OS, ADAMTS8, RP11-389C8.2, CTD-2583A14.11, ANGPT2, MYH11, IFI161, CD151, SOS1-IT1, SDCBP, HPGD, MT2A2, RP11-254F7.2, SUSD2, ITGB1, SIX1, ATP8B5P, RRAS, RP11-1084I9.1, FMOD, ITPR3, UACA, ANXA2, PPFIBP1, FMO3, ATP1A23, RP3-348I23.3, PKIG, XAF1, EEF1D, UBE2L6, SLC19A3, PODN, CDH5, SOX17, MT-TD, RP11-492E3.2, SOX18, TESK1, BCL2L10, RPS16, HRC, ISYNA1, NUDT2, VAT1, TSC22D1, IRF1, PAWR, RGS5, S100A16, RPS29, LINC01388, HERC2P2, ERVMER34-1, NAMPT, WEE1, AIF1L, PON22, CTD-2033D15.2, RPL28, RPL27A, LINC00882, ENPEP, SPARCL111, NAPA-AS1, DOCK9, BCL6B, RN7SL752P, TGFBR2, VIM, MRPL1, RP11-290C10.1, BSG, RPL35, HES4, FOXC2, SNAI1, SHC2, CBFA2T3, PLEKHG1, FKBP1A, ULBP2, RPSAP51, ZBTB38, ERRFI1, RP11-3K16.2, RPL131, RPS20, TRGC2, ZNF394, LMNA, PTPN14, ACTB2, PEAR1, ANXA2P2, BTG2, VAMP5, KLF4, SLFN12, GBP4, RP11-390K5.6, MX2, SLC3A2, TIMP3, BMP6, RN7SL51P, TNS2, PDE4C, ANTXR2, ZNF407, IFIH1, RP1-142L7.5, RPL23, C1ORF64, SYNE2, TAGLN, RCSD1, CCNL1, TMEM45B, FLT4, SGOL2, CP1, DUSP1, ESM1, APOL3, RAMP3, HSPA1B2, PLXDC1, C10orf10, NOS3, SEPW1, ACER2, SCARB1, RPL34, 2019-03-02 00:00:00, RP11-158I3.3, SLC6A13, COL4A1, C2CD2, SELE, SVIL, WBSCR16, ADIRF-AS1, C10orf54, IL18R1, NUP210L, CCNI1, STARD8, ST6GALNAC3, SYT15, CFI, BTNL91, TMEM1231, ZIC3, RPL13A, PSMB9, RPS11, CNOT6L, JUNB2, ST6GALNAC1, MT1X, SLC7A5, ACVR1, SOCS2, CCL19, LXN, AC011526.1, MECOM, RP11-293A21.1, MYO1B, PERP, TPI1, HEXIM1, ALS2CL, SLC38A3, GATA2, H3F3B2, TSPAN9, HRCT1, PPARD, QRFPR, MYCT1, HTR1F, SNX33, SLFN5, COL3A1, AVPR1A, RERGL, PXDC1, RBM17, KIF5B, XPNPEP2, PGR, RP11-363E7.4, SLC22A2, RP11-401P9.6, ABCG2, CEP89, ARRDC2, RP11-589C21.6, LAMA2, PIK3C2A, ARL13B, PIK3R3, BMP2, RP3-486I3.4, HSP90B1, RBM43, GPR85, TPM4, GPR124, BMP4, COX4I2, AHNAK, FAM26E, ACVRL1, RPL37A, ASPN, LHFP, CD59, RP11-138I17.1, RAC1, MX1, RP11-373D23.3, GGT5, AGTRAP, SLC30A1, CDYL2, MRPS24, IFI44L, TNS1, PLOD3, TNFSF10, PROM1, FZD10-AS1, MIR143HG, RPL38, BTBD6, TBX18, MVP, ARHGEF17, SYNE21, TPM3, RP11-392P7.1, STARD13-AS, IL1R1, SLFN12L, LINC00924, PTPRK, RPS4X, COL14A1, RARRES2, RPL19, FTL3, SPOCK21, PTH1R, HSPA1A1, LTF, SPARCL1, SLC9A3R2, ABO, ARHGAP29, RUNDC3B, RPL41, CDH6, TOPORS, CCDC3, RAI2, ABCB1, CRISPLD2, TESC, ETS1, ZNF408, TFPI2, ANP32B, COL1A1, STC2, LINC00992, ITGA6, AC141928.1, GIPC3, SLC39A10, ID3, IFNGR1, PXN, WNT11, RP11-420L9.5, DMBT1, C1orf64, KDR, CXCL2, FLT1, VIM1, PALMD1, RP11-48B3.4, CAPNS1, FAM46C, SLC12A7, IFI44, LIN9, MXRA7, MT1M, HMGB1, CAST1, FLNA, KANK2, PTPRB, IQGAP1, MYH9, SUV39H1, LINC00571, LAMC1, AC083843.1, XAF11, HNRNPA1P54, SORBS2, FLI1, KLF11, TJP1, ASS1, AC006116.19, HES12, MT-TL1, RNA5SP111, JUNB, FAM107A2, H2AFZ, KDELC2, RP11-569G9.7, ITIH2, BLOC1S3, EEFSEC, SLC5A6, PKHD1, CETP, TUBA1B7, RPS6, TMSB104, KANK3, ZNF274, S1PR1, ACTG11, VGLL3, MYL61, FAM21A, EMCN, GPX3, SHANK3, GATAD2A, SLC16A6, GPR116, DDX51, ACE, PROCR, RBMS2, ADAMTS9-AS1, BST2, COL1A2, ASAP1-IT2, GPR108, NOTCH4, RP11-327L3.3, SLC2A3, HLA-E, RPL7P28, EMP1, SOCS3, NR4A1, MT-CYB1, SIK2, GAPDHP29, PRRX1, MT-ND4, EGFLAM, RP11-714L20.1, LEF1, CYR61, JUN, RP11-252I14.1, PLA1A, OLFML1, SOX7, CEBPD, RPS3, MTRNR2L10, U73166.2, IGF2, FZD6, SEC14L1, PML, TSKU, DPEP2, RP11-345J18.2, UTRN, RP1-193H18.3, SLC6A12, LIMS2, MT-TF, OPA3, FGD5, PTGDR, TDGF1, MT-TA, PCOLCE, RPL13AP20, BACE2, ADGRF5, YBX31, MT-ATP6, MAST2, ELOVL7, GADD45B, CLEC1A, S100A6, CA5B, RP11-654A16.1, GPIHBP1, HSPA12B, MYO1C, HERC2P3, COL6A2, TPM11, TNFAIP1, MT-RNR1, ADAMTS9, SLC6A20, ROBO4, FOXQ1, CAV2, EHD2, ANXA5, PFN1, ADD1, RPS193, STOM, LGALS3, FBXO39, HNRNPH11, CARD6, HSF1, MYL9, HSP90AA1, FN1, ITGA11, KCTD12, P2RY14, TNXB, FURIN, PCCA, GJA5, EEF2, FOSL2, LINC00920, TRAPPC2B, TMSB4X4, CCNY, ZIC4, DENND2C, BRD2, EMP2, RSU1, ETS2, DDX11, SAV1, INSR, DANCR, COLEC12, ECE1, ATAD2, DACH1, NES, ZMYM1, SPSB2, ACTN4, HYAL2, FLVCR2, DUSP11, S100A10, NXN, FOXL2NB, C12orf57, B2M, CAV1, PTRF, AGRN, KIAA0355, CPD, RAMP2-AS1, NR4A11, LSR, MT-TY, SLC13A4, CTA-212A2.1, GSK3A, PSMB8, RP11-340L3.1, METTL21B, RPL18, GSTP11, ISG15, RHOA, TMEM256P2, ANXA3, GNAI2, CES1, SULT1B1, GPX8, CHST12, MT-RNR27, CSRP2, GPCPD1, IGFBP3, AKAP12, SEMA3G, EIF4G2, CCDC141, USHBP1, CASQ2, RPS9, RBM20, CDC45, TUBB, ST6GAL1, VCAM1, CTBS, DAB2IP, AHNAK1, ANO2, OAS2, PTGDR2, RPL4, PTPRM, RP11-358D17.2, C2CD4B, EPAS1, MT1F, EBF1, IRGM, RP11-302L19.3, RP11-506B6.6, MARVELD2, EEF1A1, ICAM1, RP11-757G1.6, ACTA2, GNB2L1, CEMIP, POLR2L, GIMAP7, HEG1, TINAGL1, RP11-545A16.4, PTN2, ABHD14B, FHL3, KLF6, ZCCHC14, PTEN, PTGES, DDN, POLRMT, IGSF9, PLCB4, NFIA, RASIP1, RP11-76C10.3, ANPEP, FSTL1, CSRNP1, MT-TM, ITGA10, RHOC, PARP9, KTN12, CYYR1, RPS23, RPLP2, A4GALT, BATF2, CXCL12, PMEPA1, RP1-142L7.9, NDUFAF3, LINC00222, ATP7B, SNRK, MT-ATP8, PDLIM1, NYNRIN, GIMAP6, IFI6, AP006216.5, RP11-444E17.6, MEGF6, SLC38A11, CDK2, ALPL, CMPK2, SLC4A2, WARS, ESAM, SLFN13, IYD, ING1, RP4-539M6.22, RP11-315D13.1, SLC38A5, SLCO2A1, ANXA1, DYRK3, ENG, RP11-149P24.1, RGCC, LAMA5, ECM1, MYL12B, SERPING1, GJC1, PCGF2, AC007743.1, KCNE4, GPR133, JUND, CAVIN1, FHL5, PARVB, RPS21, NSUN6, MYL6, LAPTM4A, KLF2, CTD-2363C16.1, PAPSS2, MLIP, HERC2P9, RP11-1074O12.1, EML1, PCBP3, TAP1, TUBB4B, NID1, ARFGEF2, SMOC2, TBPL1, B3GNT2, EIF3A, CGNL1, APOL4, SOX13, Endo, CYSLTR2, SLC7A1, MYOCD, PTTG1IP, VWA2, AC017104.2, FAM122C, ISM1, HERPUD1, ADIRF, SMPD4P1, IGFBP7, RPLP1, LRG1, LMO2, CSNK1G3, TM4SF1, ARHGAP42, ACTN1, AKR1E2, SLCO2B1, PLAT, AJUBA, BGN, CNN2, SMIM3, IFITM1, DDIT3, KIAA1683, HBB, ACSL5, TM4SF18, RALB, FAM213A, CALD11, OST4, AC013463.2, CFL1, SIK11, HLA-C, NDUFA4L2, COL4A2, RAB13, ID1, ECM2, IFI35, ABLIM3, GADD45B1, VIT, ICAM2, SLFN11, GSN1, LRRC37A11P, KIAA1462, IER2, HLA-A, PAQR5, RSAD2, IL1RL1, ELTD1, FRMD3, GABRE, HEBP2, NET1, DEGS2, S1PR3, GBP1P1, RPS8, TAF13, B2M1, PPFIBP18, LZTS2, BCL7B, CBLN3, RP5-1009E24.8, LY6E, RN7SKP203, FAM89A, HYAL1, ITM2B, COX7A1, RP11-181E10.3, EVA1C, IFI61, GSTO2, DSTN, FRMD6, NCL, APOD2, TACC1, RHOB1, GSTP1, RPGR1, STAT3, ORC5, APOLD1, CD44, PRSS23, TIMP1, CNKSR3, PSMC3, FOXF1, MT-TG, TTLL1, C1R, PLOD1, OCLN, LMCD1, BTNL9, PPP1R10, TES, PALMD, LINC00998, PES1, SNTB1, ZFP361, FMO2, CTSV, FLNB, NAGS, ZNF823, SLC20A2, ACTG2, C10ORF10, PODXL, ISLR, SLC35A4, NBEAL1, RPL3P4, ATP5E, TCF7L1, P4HA2, INMT, CFAP45, RP11-296P7.4, VCL, PHF10, MFAP4, CYB5R3, WWTR1, TRIM28, RP11-268J15.5, CA4, ESYT2, SLC16A2, MT-ND1, RBMS3, DCBLD1, TWIST1, PTRF1, PABPC11, RN7SL2, TTN, NEDD9, EFNA1, DEAF1, RNF152, ATP8B1, PDK4, ADPRM, RP11-670E13.3, RPS5, RBCK1, FDPSP8, MAGEA12, EIF3I, KDELC1P1, MT-ND21, RPL3, CD46, OSMR, RP11-474D1.3, STX10, TNFRSF10D, HERC2, RPS28, MT-RNR2, ID11, GRP, SULT1C2, SLC16A13, SPINK8, PDCD4, AKAP2, RPL18AP7, RP11-3P17.3, HMCN1, PPP1R15A, NHSL2, MT1A, ZFP36, TNIP1, INTS12, CXORF36, PTMS, SERPINH1, BTG21, PGF, TPM1, EDNRA, MYL12A, CCDC68, RP11-553L6.2, SYDE1, ARHGAP10, GALNT15, FOXL1, FAM134C, RPS12, PKN3, PYGO2, HLA-F, CAPN12, SPARC, EDN1, JAG2, RP11-777B9.1, SLC39A13, TEAD2, RP11-394O4.5, TGM2, TMEM204, THAP3, FAM129B, TLN1, MIR22HG, IFITM3, NR3C2, C8ORF4, RAB37, APOBEC3D, MT-TR, GCNT1, UBE2S, GNG11, LRRC17, CAVIN2, D21S2088E, CSDE1, TRIM56, GUK1, LNX2, SNHG8, FOS2, CENPP, MATN3, LAMA4, EHD1, CD320, EDN3, ITM2A, CRIM1, RAB44, NLRC5, NOSTRIN, RAMP2, CFH, YES1, RNASE11, GGT1, TRAM2, ZIC1, RPS27A, MCL11, KRTCAP3, SHISA5, SYNPO2, NEURL1B, PRELP, RP11-752L20.3, SNHG5, FOXP1, PROSER2, SNAI2, TIE1, ZBTB10, CLEC14A, BAMBI, FBLN5, NKD1, CALD1, RP11-758P17.3, SOS1, IL32, IL15RA, HELZ2, KLF9, TUBG1, NOTCH3, IFITM2, TRIP10, DEK, AC104781.1, RP11-573D15.2, RELA, MFSD2A, TXNIP, DACT2, SPTBN11, PECAM1, CAP1, ARAP3, PCAT19, SMG1P4, SORBS21, ANKRD26P4, ATP10A, RBPMS, RP11-405M12.3, RPL12L3, LINC01515, FOXF2, GPR4, ITGA1, CDC37, SMIM10, TENC1, FHL2, OMD, MT-ND51, SIK1, 2019-06-02 00:00:00, PTMA8, ID31, CRIP2, TPT1, ZEB1, SWAP70, NFE2L1, RPL36, MGLL, C2ORF15, RPL7P19, SKAP1, TSPAN14, RP11-744N12.3, FENDRR, U47924.6, UPB1, MRGPRF, RP11-803D5.4, UBC2, MGP, PRX, C1QTNF1, CTD-2135D7.5, CMAHP, RPS28P7, TBC1D4, CCDC88C, SPESP1, NEAT112, SLC39A8, PABPC4L, HLA-E2, PCK1, RUVBL2, TMBIM61, LAMB2, F2RL3, SNED1, HIGD1B, CCDC101, GJA4, SLC2A1, CTA-29F11.1, CCM2L, MT-TQ, C7, VWF, SLC52A3, RND3, LEPR, CPAMD8, NT5DC2, BMPR2, EPSTI1, SGPP2, EOGT, OGN, MSX1, RP11-301L8.2, IL6, TMSB10, FOXC1"
