Cell Type,Genes
Micro,"C3AR1, AC008691.1, LINC00987, ELMO1, FCGR2C, EDEM1, RNU6-1280P, ESCO1, SRGAP1, E2F3, C3, CCDC147-AS1, CCL22, ZNF143, CH25H, FHOD1, SLC2A5, CYBB, RP11-1020A11.2, RP11-733O18.1, TLR3, RP5-1011O1.3, ISG20L2, AC002480.3, ELF4, SORL1, CNPY3, MIS18BP1, PARP4, CD300LF, CITED2, PLBD1, RNASE6, LYVE1, SKAP2, LINC01545, LINC00484, AD000864.6, RNPEP, RNU6-128P, OLR1, ZFP36L2, MASTL, RNF122, MAF1, IL10RB-AS1, RP11-107E5.3, LYN, DLEU2, PDGFB, ZNF267, RUNX1, TMEM156, LINC01141, CTD-2165H16.3, MS4A7, RP11-170L3.2, UBE2F-SCLY, TAGAP, HLA-DRB6, RASSF5, VMP1, RP11-815J21.3, TM6SF1, TLR4, AC120193.1, UBASH3B, PTPRE, SELPLG, IL1RAP, ATP6V1B2, GPR132, FCGR2B, AC002059.10, CD69, LY96, UHRF1BP1, RAPGEF2, RPS6KA1, FYB, RP6-99M1.3, DOCK2, LPL, NPM1P25, LINC01374, SUSD6, NEAT1, CCL4L1, CHD9, UBE2V1P6, RPL21P123, IRAK3, CYTL1, DOCK8, AF127577.13, SNORA40, ITPR21, CD28, SMLR1, COTL1, ELF1, RNU6-786P, BMS1P4, C1ORF132, SLC26A2, CLEC9A, HMGB3P4, AC013286.1, CD83, CXCL16, LINC01366, MAML3, UBE2E2, MARK2P8, RP11-21M7.2, IFNGR2, HK2, RBM47, 2019-03-03 00:00:00, GABPB1, RP11-876N24.3, USP6, INHBA, PLAUR, FMN1, RIN3, CPED1, DHRS9, RP11-53B2.1, C1QC, AMELX, FMNL1, RP11-289H16.1, TAB3, ITGAX, CALCR, APBB1IP, RNF213, MBNL1, RP11-8P11.4, RP11-153M7.3, RP11-360F5.3, ANKRD44-IT1, EMR4P, GPX1, ITGB2, TRIB1, C19ORF38, SAT1, LIMS1, RP11-483P21.2, RP11-750H9.5, ARPC1B, TCOF1, HCLS1, SRGN, RP11-583F2.5, FCGR1B, CTSL, LSM3P2, SYNPO2L, LGMN, LINC00676, VASH1, IL16, CTSC, ZCCHC6, MICAL1, MYC, ALOX5, RP11-691H4.3, ATP13A3, LINC01059, PTGER4, IRAK2, FAM149A, C1QA, PRRC2C, SPIDR, TBC1D14, AK3P5, AC092652.1, ZBTB21, TLR6, MS4A14, NCKAP1L, SNRPD2P1, BTK, STAMBPL1, ZCCHC8, RP11-574K11.27, PIK3R5, TMEM52B, AC008592.5, MB21D1, SLC35A3, NEAT110, SYAP1, RP11-96D1.5, AC244021.1, RP11-196G18.1, OSM, LDLRAD4, TNFSF18, SDCBP, TSPYL5, RP5-1033H22.2, ATM, RTTN, FAM46A, RP11-442G21.2, NRROS, RPL18P10, CTB-41I6.2, RP11-274J7.2, CHST11, SLC18A1, FALEC, STK17B, DDX21, RP11-61F12.1, PLAU, RP11-158K1.3, XAF1, DGKA, CREG1, LYPLA1, RAB7B, SIGLEC14, HLA-DQA1, NCF4, SH2B3, SPRED1, TMC8, GLUD1P3, CD274, RP11-238K6.1, AC010733.5, FCAR, TXLNB, PDPN, ARRDC3, SLC1A5, RP11-631M6.2, DLGAP1-AS2, MNDA, C15ORF39, TBC1D22A, EIF3L, GCNT1P3, IL6ST, RGS10, ABR, IKZF1, RP11-165F24.3, ANKRD22, RP11-677N16.1, CCL4, COL8A2, TGFBR1, SUMO4, DNAJC2, CCR1, GNLY, RAB20, ZMYND15, SNORA67, SUSD3, RP11-1149M10.1, TRIM38, RP11-126O1.5, RP11-705O1.8, CHST14, DUSP2, SOCS6, SLC50A1, IL13RA1, SNX9, CD276, RP11-24F11.2, DCTD, CTB-41I6.1, ERMAP, RP1-18D14.7, UBXN11, LINC01375, ACY3, AC084082.3, MED12L, ATF6, RP11-172E10.1, BHLHE41, RP11-705C15.3, ZNF3, RP11-160H22.3, TNFAIP8L3, NR4A2, FAM91A1, RP11-946L16.2, TAL1, RP11-325F22.2, RP11-82L18.2, CCRL2, C1ORF162, RP11-76E17.3, LINC-PINT, RP11-489O18.1, MILR1, RP11-318K15.2, AC003080.4, ACSL1, STK4, ATP8B4, RP11-652L8.4, EML4, SH3TC1, C5AR2, ABCB4, HCST, S100A11, CDCP1, SLC37A2, CLEC7A, RP11-174G17.3, RP11-16C1.2, MESDC1, ST6GALNAC3, GRID2, RP11-12A2.1, RAP2B, TLR10, TREM2, SPTLC2, MIR221, ADAP2, HCK, SERPINB9P1, SASH3, EVI2B, RP11-473O4.1, SYNDIG1, HLA-DPB1, TMSB4X3, CSF3R, QKI, CH17-118O6.4, KCNK13, RP11-81A1.7, CD80, HENMT1, CD86, PBDC1, FCGR3A, RP11-274J7.3, LILRB4, LINC01480, CTD-2006C1.2, CLINT1, ARHGAP9, PLD4, CREB3, HLA-DPA1, SAMSN1, TLR2, LINC00996, MAP2K3, IL1RL2, RP11-162J8.2, DNMBP, LINC00854, FAM105A, ETF1P2, AC004593.3, RHOG, CDV3, TNFSF8, THEMIS2, RP11-575A19.2, NUFIP2, SCIMP, ARHGAP15, HCCS, ARL5A, NABP1, AP000640.10, DNAJC10, LPAR5, IL4R, TNFSF15, RP11-443B7.3, MIR5690, FPR1, RP11-552D4.1, CD300LB, CYCSP1, CD14, RP11-183I6.2, MALT1, IFNE, ACTB, KIAA0226L, CSNK2A2, FCER1G, FGL2, FBP1, LPCAT2, RP11-244M2.1, TLR8, CAPZA1, MT-RNR25, RILPL2, CORO1A, RP11-41O4.1, RP11-281P23.1, ARRB2, TNFRSF1B, RP11-1082L8.4, DUSP6, RASGEF1B, PLEKHO1, SP140L, POU2F2, GRN, PCM1, RP11-492I2.1, IL18, CX3CR1, SGK1, BCL2A1, RP11-128B16.3, CDC42EP3, AC009505.2, DOCK10, CD164, ZEB2-AS1, CD84, CCL2, RP11-452F19.3, RP11-589N15.2, GPR183, C10ORF128, BATF3, PDE3B, TNFRSF12A, DAGLB, PRR13, RP11-511H23.2, SLC2A9, CXCR4, HAMP, LPXN, ZSWIM6, KIAA15987, ITGAL, HAVCR2, DEF6, NFATC2, TNFRSF13C, GBP2, PILRA, GRB2, UTP14A, RP5-1031D4.2, EIF2AK3, RP11-467H10.2, REL, RP11-448G15.3, HS6ST1, TRAF6, PLVAP, CARD11, PARVG, HSP90AA15, C4ORF45, TLR7, FGD4, DAPP1, RP11-345I18.1, GTF2E2, NAV3, CYP19A1, IL1RN, RP11-480C22.1, UGCG, AAED1, EHD4-AS1, ALOX15B, RBM25, AC074289.1, ARHGAP25, ARID3B, RHBDF2, FAIM3, MAPKAPK2, TMEM71, DR1, RP11-750I4.2, RP4-781K5.5, AKNA, KLHL6-AS1, TPM3P9, HLA-E, SPI1, AMZ2P1, RP11-638I2.10, SRGAP2-AS1, RP11-67L14.1, AOAH, MAML2, ETF1, CHSY1, MIR4420, TCF12, STX11, INPP5D, PTPN6, GLIPR1, CTD-2410N18.4, BRAP, TNFSF14, RUNX2, NLRP4, HEXB, RP11-213H15.1, MS4A4A, GTPBP4, CSF2RA, CD300C, MEF2C, M6PR, RP11-439L18.1, LINC00264, CTD-2371O3.3, BCAR3, EPB41L2, ARID5A, CSF2RB, EMR2, EVL, AKR1A1, RP11-415J8.3, RP11-212I21.4, SPHK1, ELMO1-AS1, SLC15A4, SIGLEC10, ZNRF2, CD300E, RP11-317B3.2, MS4A6A, PPARG, ANKRD10-IT1, AGPAT9, RNVU1-20, H2AFY, RNF144B, SGPP1, NFKBID, VHL, RP11-12O16.1, C10ORF11, RNA5SP237, VAV1, CNOT6, ARGFXP2, MYBPC3, ST8SIA4, AC006978.6, B3GNT5, RNU6-151P, FRMD4A, RP6-159A1.4, CTTNBP2NL, ZFPM2-AS1, EMB, LRRK1, C16ORF54, SLC11A1, ADORA3, P4HA1, KB-1507C5.4, CTSB, KCNQ3, ANXA5, VMO1, CLEC4A, BNC2, DOCK4, RP11-342F17.1, OR2B11, LINC01136, PRKAB1, RNU4-2, CSF1R, KCTD12, CARS2, DUSP8P5, BACH1, HLA-DRA, HPS3, TGFBI, PLXDC2, ALPK3, MDM2, PSTPIP2, SLC1A32, NCOA4, ETS2, CD163, FYB1, G0S2, AC007327.5, RIN2, TLN2, LCP2, RP11-53B2.2, RP11-1024P17.1, MAN1A1, NUP54, RP11-624C23.1, ZNF490, B2M, RP11-177H13.2, ADPGK, EIF4A3, ARPC2, RP11-350G8.5, OS9, RP11-117D22.2, CTC-436P18.3, C20ORF197, RC3H1, RP11-1008C21.2, HLA-DMB, CHCHD7, RP11-53B2.4, MAFB, RASAL2, DOCK43, CYB561A3, EGR3, ADAM28, RP11-4B16.4, SNORD56B, IGSF10, RNVU1-15, DPYS, RP11-960L18.1, ARHGAP24, SLC12A6, NPC2, FMNL3, SPATA13, RAB39A, CTD-2270F17.1, MBD4, GGTA1P, SLA, RNU6-892P, ST6GAL1, CTD-3247F14.2, MTHFD2, PRPF38B, RNVU1-6, GNAI3, AC098614.2, BLNK, CELF2-AS1, RP11-16E18.3, RN7SL368P, SEC24C, ZNF700, AC007362.3, STK38L, SUCNR1, GOLGA42, AC009542.2, MRC1, RP11-96K19.4, PCED1B-AS1, CMTM7, JDP2, ANKRD44, KCNMB1, RASGEF1C, SERPINF1, RPS2, MSR1, LINC00441, CTSS, NRBF2, RCOR1, ATF7IP2, RP11-126O1.4, ATP6V0E1, SYTL3, ACTR2, WBSCR22, TLR1, BCAS2, ARHGAP22, HMHA1, CD74, FCGR2A, MPEG1, CPVL, DNAH1, CYTH4, SLC9A9, LINC00964, EBI3, RP11-154D6.1, LAPTM5, PIK3AP1, GM2A, PSMD8P1, CCL3, FAM135A, CNOT1, HIF1A, ITGAM, CLPB, RP11-573D15.9, CDC42SE1, FUT4, SERPINA1, XIRP1, CIITA, MKNK1, RP5-998N21.4, ZNF217, SP100, ZNF655, RAB32, AKAP13, LUCAT1, HS3ST4, RCBTB2, RHOH, HS3ST1, GPRIN3, SIGLEC8, ARHGAP26-IT1, RNVU1-19, MOB3A, CD180, RP11-342M21.2, NANOGP4, LY86, C5ORF58, RP11-10L12.2, STXBP2, RP11-356M20.3, RP11-114F10.3, POPDC2, ADAM9, LPAR6, AF064858.6, RPS20P15, VSIG4, RRM2B, TSR1, TNF, SORL11, RP11-439A17.10, DENND3, FGD2, MEF2A, LYZ, RN7SKP296, LHFPL2, NFAM1, ELL2, FTL2, KLHL6, MFSD1, FCGBP, P2RX4, IL10RA, ALPK2, PLCB2, CYTIP, GPR160, NAA15, RP11-484N16.1, PSMA1, RP11-343N15.2, DOCK11, ARHGDIB, SCAMP2, EIF3M, FCGR1A, CXORF40B, RP11-13N12.1, KDM6B, RP1-261D10.1, RP11-1082L8.3, LINC00852, SPN, SLCO2B1, HNRNPRP1, LAT2, RP11-283G6.5, SYK, HPGDS, SYNE4, CD300A, RGS17P1, CAPZB, RNASET2, WDR1, HLA-DRB1, NCF2, RNA5SP151, AC091492.2, SIRPB1, CD37, WDFY4, STK10, ADAMTSL4-AS1, WASF2, IRF8, MYO7A, TET2, RANBP2, SFMBT2, HAUS8, PGM2, P2RY12, Micro, PAG1, LYST, HIVEP3, IPCEF1, CH17-437K3.1, DKC1, VNN1, SIPA1L2, TPD52L2, NCOA3, IL6R, SNORA51, CTD-2647E9.3, CCR5, IL10, ABL2, PPIG, CD33, DCSTAMP, ITM2B, RP11-187O7.1, EIF4EP1, APOBEC3C, IRF5, LINC01091, RP11-515C16.1, HSPA8P19, RP11-804H8.6, ABCC4, AF127936.5, ARPC3, ALOX5AP, HMGB1P21, PLIN2, MLXIPL, DOK2, MIR646HG, CYFIP1, FOLR2, NAP1L4P1, ZFP36L12, CCL3L3, SIGLEC9, AC007879.5, FRRS1, FAM177B, RP11-142M10.2, TREML1, SLC16A3, AIF1, BACH1-IT2, RP11-762I7.4, ACTG1P14, CD4, AL139125.1, ENPP1, WDR91, SOAT1, IFI16, DENND1C, AC008703.1, PRRG4, RP11-34E5.4, GMEB1, CXORF21, METAP1, NAA20, SMAD3, PLEK, SCIN, P2RY13, RP11-946L16.1, C9ORF66, DIP2B, RN7SL288P, UBAC2, RGS18, NPL, GNB4, GPR65, LCP1, CTD-3252C9.4, NEDD9, TYROBP, MCM9, EEPD1, RP11-53B2.6, PELI1, PDK4, LINC00649, GNA13, ADAM17, RP11-556E13.1, TNFRSF11A, CHD2, ZNF812, F13A1, OTUD1, RP11-701P16.2, GHRLOS, TFEC, SLC7A7, RP11-142E9.1, IGSF6, CLECL1, RNF20, PTAFR, SLC25A25-AS1, CFLAR-AS1, CASS4, C1ORF186, FAM49B, CASP1, RGS1, C1QB, MYO1F, HLA-DMA, AC002044.1, ZNF415P1, ITPR2, ITGB3, TMEM106A, KDM7A, CTB-114C7.4, PABPC1, RP11-445F6.2, PKN2, EGR2, LIPM, RP3-340N1.2, FPR3, DIAPH2, RP11-141B14.1, ARRDC5, RP11-283G6.6, ARHGAP30, SERPINB9, GPR84, GMFG, LINC01268, NLRP3, SMAP2, PARN, GPR34, LRRFIP1, LINC00936, RP11-439A17.9, MOB1A, TMED5, CD226, PTPRC, TRA2B, CAPNS2, RP1-225E12.2, RPA2, MAP4K4, ATRX2, MORC1, CYP2R1, LINC00152, NAB2, HCAR2, SRGAP2, AC127904.2, HNRNPA1P71, SNX29, CHD1, STAB1, SAT12, FCGRT, TBXAS1, PYCARD, CTD-2262B20.1, MGAT1, KBTBD8, GYPC, USP53, MEF2C11, PIK3CG, AC007556.3, UCP2, CDC42-IT1, GCNT7, MPP1, IGBP1-AS1, PICALM, RP11-707A18.1, SLC43A2, RNF149, DDX39A, C5AR1, MYO9B, CCL20, SRRM2, CAP1, GAL3ST4, LRMP, USP15, NKX3-1, CBWD2, GNL2, FCHSD2, KYNU, YIPF1, SPP1, CMTM6, RP11-712P20.2, SRGAP2B, ZBTB1, SPP12, IL1A, SWAP70, CD53, B4GALT1, C10orf11, RP11-81A22.4, B3GNTL1, AREL1, OGFRL1, RP11-53B2.5, CEP170, CAPG, APAF1, SP3, PTGES3P1, GGA3, LST1, RP11-196G18.3, ATP5J2P6, VAMP8, MR1, MTHFD1L, MIR222HG, LUZP1, ZNF805, EIF4E, SRGAP2C, AP003481.1, CTC-428H11.2, ASH1L, RP11-96D1.10, SLC25A37, IL1B, SP140"
Oligo,"ELMO1, SIRT2, EDIL31, ACTL6A, RP11-259K15.2, LANCL1, CLCN4, SH3TC2, RP11-231C18.1, 1975-09-01 00:00:00, RP11-390E23.6, DNM3, ZNF728, PPAP2C, MIB1, PAIP2B, CA10, ABHD6, CNP1, SFT2D1, COBL, PAXBP1, APLP14, RP4-630C24.3, HHIP-AS1, DPYSL2, RP11-159M11.2, EXOC5, LINC00883, RP11-498C9.15, MOBP, SGK2, ECHDC1, PHLDA3, DNAJC21, SCD1, SCD, CACNA2D1, CTC-366B18.4, ABCA2, BBX, AKNAD1, YEATS2-AS1, TPPP3, TMEM165, ZBTB20, ERBB31, LINC00609, PHACTR3, ZC3H13, SLC45A3, RP11-344A5.1, EFS, POU2AF1, PTMA5, TTC23L, PCDH94, KCTD9P4, MAP6D1, RP1-223B1.1, TJP2, BOK, LURAP1L-AS1, HECW2, RICTOR, ZNF565, KIAA1244, GLUL2, LAYN, GALR1, RP11-298E2.2, PLP1, AFMID, TMEM139, CIR1P2, CCDC88A3, CPB2, MTFR1, URI1, FMNL2, NHLH2, NXPE3, RP11-446H18.5, NCAPD2, TF2, NACAD, FOXN2, APP, MAP7D1, RP11-750B16.1, NEAT1, RTN4, APLP15, PRCD, LACC1, CD22, CNTN21, SLC44A17, DPF2, RP11-340F14.6, SCDP1, CD9, FOLH1B, PCDH15, PDE8A, ENPP2, AC000068.5, RP11-380M21.2, MIR181A1HG, SOX2-OT, MTF1, PTGDS9, RP11-1023P17.2, AGTPBP1, CSE1L, ST3GAL5, CENPB, CPNE2, UBE4B, NDRG22, LINC00639, DLC1, ZNF536, WSB12, KIAA1598, UBE2E2, PAXBP1-AS1, RP11-283C24.1, MAP71, EVI2A, TUBA1A, INSL3, RP4-668E10.4, LTN1, BOD1L1, GAB1, SPOCK3, CNDP1, MBP, NTM5, ERBB3, FAM124A, LHPP, KAT2B, AP000255.6, SLC12A2, BCAS1, VRK2, CCDC88A, AATK, ELP5, ASPA, NBR1, ZEB2, TTLL74, PDHB, NKX2-2, CACNG4, CARNS1, ZNF841, LINC01232, ZDHHC20, IPO13, GATAD11, PDIK1L, C21ORF91, KLRC2, FAM229B, RAB11B-AS1, PPM1D, PTPRD, AKAP9, TMEM144, TWF1P1, OTUD7B, RP11-9G1.3, MND1, LPAL2, KIAA09304, ZBTB6, ANLN, COL16A1, ASB13, FAM218A, PIEZO2, NR0B1, AATK1, CDK19, PALM2, RP11-1018N14.2, SEMA6A, ZNF826P, PTMA4, YPEL2, LINC00320, SRD5A3, MAP4K41, SUN2, GRHPR, C10orf90, LINC01099, AZGP1, LRRC63, ADIPOR2, MEGF11, SENP2, RP11-809C18.3, RAB40B, CNTF, DHCR24, CENPI, RP11-862L9.2, BTBD16, MTRR, PEPD, ARMC1, KIZ, ATG3, BVES, TMEM230, PRRC2C, TCP11L2, RP11-346D14.1, SYNJ2, RASGRP3, CTD-2213F21.2, 1974-09-01 00:00:00, C9ORF3, BCHE, PHLPP1, ZDHHC9, AGPAT4-IT1, SOSTDC1, SUGT1, CDK181, CTC-203F4.2, PRR26, LDLRAD4, AC091814.2, PDE4B, CLASP2, APOD, AMD1, BRCA1, RP11-320M16.2, PCA3, SPDL1, ZNF488, ZNF559, LPGAT1, MBP7, QDPR, QDPR1, SLC35D2, AC084149.2, PMP22, LGR5, C1ORF106, GPM6B5, PHLDB11, BTBD3, PRR18, GPR17, PALB2, CASP8AP2, PDGFRA, ANKRD65, COL9A3, DIXDC1, APBB2, IKZF2, COMMD3, SFTPC, CERCAM1, CCDC160, CRADD, DSCAML1, ANKRD28, PPP2R3A, KIAA15984, RALA, GALNT5, CDC42SE2, GOLGA4, DHFRL1, RP5-1198O20.4, PLCL1, RP13-93L13.1, DUSP10, RNASEH2A, AIF1L, PDE6B, HEBP1, C12ORF66, MXI1, PTMA, TAS2R40, PXK1, FCRLA, ZNF682, ATG4C, PTBP2, WSCD1, ENOSF1, SEMA6A-AS1, COX5BP6, NKAIN1, TUBB4A, ALAD, NENF, DYNC1LI2, SNX6, RP11-404G16.2, 2019-09-08 00:00:00, AGPAT4, VSTM2B, OMG, FAM177A1, SCHIP1, DYNC1I2, ZNF576, AFG3L1P, ANKRD36C, PLP18, GLTP, HAUS2, MIR219-2, PIK3C2B, CNTN2, ST181, NKAIN2, BAZ2B6, RP11-468H14.2, ARHGAP211, RMND5A, RBP7, SAP18, ANO4, PPP1R21, GPR62, MAN2A1, RASAL1, HIP1, SLCO1A21, PRKCQ, LDB3, PEX16, PDE1C1, CNDP11, RP11-161M6.2, TMTC2, FAM73A, BNIP3L, KMT2E, C1ORF122, LPAR1, FAM178A, RNF13, ITGA2, PCGF6, TYMSOS, RDX1, MYO61, KLHL31, TSPAN15, AL138751.1, LINC00601, CDC42EP2, FKBP7, HIST1H2AC, MIR219-21, NINJ2, SYS1-DBNDD2, DLL1, SH3D19, PPP1R14A1, PLA2G16, ZZZ3, RP11-303E16.3, ENDOD1, RP11-299G20.5, RP11-267C16.2, CTD-2058B24.2, COL9A1, FBXO32, NEAT17, PCSK6, ERBB2IP, RP11-863H1.1, LINC00909, KLHL2, TMEM125, RP1-265C24.5, PDE1A, ZNF415, CDC42BPA, RP11-26M5.3, CTD-2380F24.1, QKI, S1PR5, BEST1, GAS7, RP11-603B24.1, OLIG1, SEMA4D, LAMP21, PAPSS1, KLRC3, ADCY5, RP11-390B4.3, AOX3P, EXOC6B, FLNC, NIPAL3, HPN-AS1, FAM221A, ZFYVE16, FAM107B, GDE1, DYNC1I2P1, DNAJC6, NIP7P3, PLEKHG3, FNBP1, RP11-1023L17.1, NAP1L6, AC005220.3, APLP1, AC109496.1, SGPL1, CPB1, SNHG18, KIF2A, RP11-66B24.7, ST13, ZGRF1, GOLGA7, PGM3, RP1-301L19.1, PRUNE21, NKTR, SET, RAD51AP1, HSD17B3, CCP1106, MEX3C, NCAM2, RP11-61I13.3, LINC00844, MCM7, CLIP2, SEPP11, WDR44, KLHL32, RP11-35N6.1, ZEB21, PTGDS8, FRYL1, LINC01105, PTPRK, TMEFF2, TTLL7, DUSP7, TMEM1441, SCARB2, FANCB, SFRP1, RP11-352M15.2, RP1-146A15.1, RP11-953B20.1, C8ORF46, PCDH95, SERINC5, EBAG9, C11ORF98P1, ANP32BP1, CEP97, RP11-151G12.2, ALCAM, SECISBP2L, MOG1, RP11-91I20.3, RP11-10B2.1, LANCL1-AS1, PRRG1, RN7SL419P, PIGN, RP11-50D16.4, PACRG-AS1, ENPP6, B3GNT7, HSD11B1, KCNJ2-AS1, DLG1, TF1, SPG21, KCNH8, RP11-96D24.1, HPN, FOXO4, MTURN, ABHD17B, FCHO1, DFNB31, KRT18P26, BMP8B, SGK1, UGT8, MTMR2, TJAP1, RP11-556I13.1, TTL, DOCK10, CTC-529P8.1, PPP1R8, FANCL, ADSS, IP6K3, GABRQ, TEKT3, CBR1, GNAI1, RP11-662G23.1, TULP4, PTP4A2, MUSK, PTGDS, APIP, ST18, PTPLB, HN1L, ZFYVE161, SWT1, STK31, AKTIP, RP11-298D21.1, NDE1, AP002954.3, SRRM1, GDNF, MTND5P11, TJP1, AK5, AC011243.1, COL4A5, JAM3, PYROXD1, HBS1L, KCTD4, RP11-98J23.2, TACR3, GAB2, 2019-09-07 00:00:00, CTD-2170G1.2, CLK1, FRMD4B, SORT1, GPRC5B2, MOBP7, FTH15, LARP6, PWWP2A, DNTT, ENOPH1, FA2H, IL1RAPL1, FRMD4B1, RP11-131P10.2, RP5-907C10.3, SBDS, CRYAB2, NIPAL4, WDR20, KIF1B, RBM25, BACE1, RP11-397C12.1, ARAP2, POLR1B, TRIM2, AMPD3, C7ORF25, GPSM2, ZNF577, SRPK2, TMEM64, FGF1, FBXL7, NFYA, RPLP1P6, CRYAB1, KNOP1, CDH20, CPOX, SIK3, KCNMB4, SMIM6, AC093590.1, RAB28, GREB1L, LINC01608, OPALIN, MAL, PLD1, GJC2, TCF12, RP11-149I23.3, WDPCP, CTD-2576D5.3, KLRC4-KLRK1, PSEN1, CCP110, ANKIB1, TSEN15, RHOU, SOX3, FIS1, GPM6B, FAF1, SLAIN1, Oligo, ZNF607, SLC3A1, SNX27, RP5-1039K5.19, RP11-262H14.3, CDR2L, LDLRAP1, TSIX, KB-7G2.9, ZNF506, ERMP1, CFAP20, NEK7, BAZ2B, LINC00161, SMIM5, SERAC1, LRRC8D, MSH4, SLCO1A2, FNBP13, DTD2, ICK, HMSD, ANGPTL2, MIR219A2, CA14, CDK17, IGSF8, CLCN3, LINC01411, STK39, ENOX1-AS2, SORT11, RP11-354P17.15, FAM222A-AS1, GPRC5B, SNX22, DOCK5, RTN43, COLGALT2, TTLL7-IT1, PPM1B, ANK3, TAOK1, RP11-26M5.2, LINC00463, NEK3, RP11-283I3.2, PPP2R2A, RP11-267C16.1, MTUS11, ZNF652, SAMD4B, FMO4, MATN2, SPPL3, VAMP3, NFYB, HNRNPA2B1, AGMO, C11ORF54, HAPLN2, GJB1, RNF144A, RP13-93L13.2, TF, PRKCQ-AS1, XXBAC-BPG55C20.7, PTPDC1, HSP90AA1, RAB33A, CNP, PLXDC2, USH1C, HS3ST5, TMEM1651, RP11-1055B8.3, ADAMTS18, ARHGEF37, ATP8A1, LINC01445, PHYHIPL, FAM222A, QKI3, PXK, CLDN111, ANKRD122, FUT8, ZNF572, THBS2, TALDO1, GSKIP, SMOC1, CPB2-AS1, CLDND12, RP11-296E7.1, TMEM206, ZNF585B, PRDM8, SLC44A1, CLEC12B, FAM192A, ZSCAN12P1, MBNL2, RERE, KBTBD2, ERBB2IP1, ATP10B, RP3-399L15.3, ENPP4, FOLH1, C5ORF64, TMED4, LAMP2, CAPN13, PAQR6, PCBP4, RN7SL413P, MIF4GD, TBC1D32, S100B, RP11-285F7.2, SPP11, CUTC, CSRP1, ATE1, CLDND1, POLR2M, TMEM189, ITGAE, RNASE1, MYO1D, RPS6KC1, MAG, CERCAM, DBNDD2, TPPP, NAALADL2, TIAF1, KRT8P1, ACER3, KTN11, SH3PXD2A, KEL, ENPP21, XYLT1, HIPK2, CHADL, MURC, SHTN1, TRIM59, LCORL, AC079117.1, NMUR2, DNM3-IT1, PCDH9, ZNF664, 2019-03-01 00:00:00, PTK2, SHC4, MOG, PIP4K2A1, NDUFS7, RN7SKP56, TGFA, CDC42EP1, ITGB8, ANKRD18A, NDUFS5P1, DUSP16, ARHGAP21, AC012494.1, TGFB3, SLC22A15, FBXL5, ZNF175, TMEM87A, AGAP1, MOBP8, MYRF, PNPT1, ABCG1, GSN, ZSCAN29, SLC44A18, ASPA1, RP11-243A14.1, ZDHHC11, AGA, GPR37, SPSB1, NFASC, SNX30, LIN54, RHBDL2, CHD1L, ARAP21, PPP6C, RAPGEF5, RP11-411K7.1, RP11-66B24.1, RP11-384C4.3, DDX17, GALNT6, NIPA1, LINC00706, FAM131B, PLEKHH2, LHFPL3, WIPF1, PCNA, RP5-1044H5.1, PPA1, RP11-81H3.2, APBB1, DYSF, OR2L13, RTKN, PEX5L-AS1, SRP72P2, PAPL, RP11-387A1.6, C9ORF170, MIPEP, RP11-14N4.1, POGK, KIAA15985, OSBPL1A, HSPA2, TMTC4, COL9A2, AHR, AMER21, FAR1, KIF13B, WRB, RP11-339B21.8, CRYAB, NASP1, RP11-946P6.4, RP11-10L12.4, KIF6, HSD17B4, ERMN, ENOX2, RP1-73A14.1, MOB3B, QKI4, RP11-143A12.3, ANAPC51, TTLL75, PVRL1, CHN2, TBC1D15, FBXO7, ZNF146, MAP7, USP32, EPN2, LINC01170, AL109761.5, MVB12B, GLUL3, RP11-139H14.5, ELOVL1, BCAS11, CMTM5, HDAC11, CTA-228A9.3, ZNF271P, SLCO3A1, DOCK51, INPP1, RP11-203J24.8, ANKS1B, LHFPL3-AS1, PIP4K2A, 2019-09-04 00:00:00, AC004603.4, ST3GAL6-AS1, AC018647.3, PTPN11, KCNQ1OT16, CTD-2058B24.3, IKZF5, CUEDC1, RAB3IP, RP11-381K20.2, LACTB2, NIFK-AS1, PLEKHB1, LINC01299, ABCA21, CA2, RP11-407G23.7, PLLP, LINC01549, KIAA1324L, DICER1, FRYL, TBC1D5, LINC00870, MARCKSL1, WNK1, FHIT, TMEM258, RP13-36G14.4, FAM126A, CLCA4, RP11-548P2.2, RAP1GDS1, AC007106.1, MGA, MRPL52, SAPCD2, BEST3, COX6CP13, SLC35A5, GZF1, TMC7, LRP2, SOX8, MKRN3, RP11-343J18.1, FAM219A, NDRG1, CHST6, CDK18, CCNE2, UTP15, RDX, SLC5A11, DNAJB2, PTK21, KIDINS2201, GPM6B4, SNRPF, SPECC1, HTATIP2, ANAPC5, SPG20-AS1, ABCA8, PPP1R16B, GDNF-AS1, FAM84B, NPC1, DPYD, REEP3, MYRF1, NAPEPLD, TPRN, CTC-459F4.1, TARSL2, CSRP2BP, KLHL4, UNC5C, CD2BP2, KIF13A, TMEM98, RAB6C-AS1, GPRC5B1, C9ORF85, WDR89, MBP6, RP11-218F4.1, RP11-257I14.1, AC007163.3, RNF141, ACVR1C, MKRN3-AS1, RP11-523J2.1, RP11-272L13.4, RP1-232L24.3, PPP1R9A, FNBP12, VEZF1, TRAM1L1, ZNHIT6, PLEKHH11, THBS4, NPAS3, CCNJP2, NKX6-2, RP11-481J8.3, FRK, KIRREL3, GCA, FAM134B, ZSWIM5P2, POPDC3, LRP6, ARHGAP11A, DIP2B, RNF130, PLP19, GNAZ, ZIM2-AS1, ZNF268, SRCIN1, SEC14L5, FAM122B, CCDC13-AS1, C10ORF107, ZKSCAN1, RP11-196E1.3, NLK, FEZ1, CDH19, ZCCHC24, C2ORF88, RP11-288C18.1, PRR5L, HHIP, ZFP3, TP53TG5, ZNF708, AC004158.3, YBEY, ALCAM1, MAPK8IP1, HAGLR, TP53INP2, CTD-2049O4.1, SHROOM4, TYMS, SH3GL3, TMEM63A1, RBPJ, NUCKS1, MMACHC, ANKRD40, CCDC25, JMJD7-PLA2G4B, ST3GAL5-AS1, RASSF2, PRUNE2, CLDN11, LINC01546, RFFL, FXR1, TRIM21, C11ORF71, PPP1R14A, SCD5, CARNS11, GPD1, C11ORF39, IFT80, DLG14, PTPRD2, SPATA7, AK7, NEAT18, TMEM151A, SFRP4, SNX1, PPP2R2B, GRM3, FAM69A, CDH1, CAPN3, DNAJC22, ANKRD12, APBA3, CHCHD4, ANKS6, CACNG5, C2ORF27A, RP11-597D13.7, AUTS2, TPTEP1, FAM13C, CLMN, DST5, C1GALT1, TMEM63A, STRN, MOSPD2, NT5DC1, STMN4, ZNF738, COL8A1, EDIL3, CNTNAP4, KLK6, SGMS2, HAS2, SEPP1, RP11-407G23.4, CTC-369A16.2, AC026271.5, LGI3, YWHAQ, PDE1C, MAP4K4, TMCC2, TCFL5, THAP5, TMEM235, AC012593.1, KIF1C, CTNNA3, ZNF24, LMCD1-AS1, OTUD6B, LINC01482, RNF220, RP11-338N10.1, CKAP2L, SLC24A2, ANP32C, DST, CALD1, AMER2, KCNJ2, RP11-406O23.2, LIMCH1, MAP4K5, ASUN, MYOT, PEX5L, SOX2-OT1, TTYH2, RP11-716H6.2, CREB5, PLEKHH1, TSPAN5, STK32A, DAAM2, EMC3-AS1, C1ORF140, MYO6, TAS2R39, NSDHL, RP11-115D19.2, C10ORF90, CTD-2517O10.6, SPP1, MEX3A, GDF6, LINC00486, DMRT2, DLG2, CFL2, DTNB, SPG20, DST4, DIMT1, RP11-277P12.20, C12ORF76, MTUS1, CPPED1, ZNF281, PKP4, RP11-546B15.1, RP11-124A7.1, PEX5L-AS2, TRMT13, CYB5R2, KATNAL1, RP4-687K1.2, TNR, TXNL1, RP11-388P9.2, SHB, STEAP1B, CCP1105, TUBA1A1, KCNK10, PHIP, PTPRD-AS1, CCDC150, NCKAP5, RP11-760H22.2, IFNA11P, TMCC3, RP11-374A22.1, CLDND11, NUDT16, PHLDB1, RP11-946L20.2, TRIM62, CCDC121, LINC00237, FMNL22, OLIG2, FRMD5"
OPC,"NXPH1, LUZP2, MTSS1, SORCS3, LSAMP, FGF12, SLC24A3, FHIT, DNER1, AC004852.2, 2019-03-01 00:00:00, SOX5, CSPG5, PSAP, APOD1, NTM6, ADAMTS17, NFIA, SOX6, ASAP1, GALNT13, CA10, LRRTM4, LINC00511, HIP1, AGAP1, ZNF462, RP11-384F7.2, COBL, KLF12, ALCAM, PLPPR1, ATRNL1, TAOK31, SETD5, ATP1A22, NKAIN3, MDGA2, SLC35F1, SCD51, GPR56, VCAN1, MEGF11, ALCAM2, LINC01322, COL11A1, GPC6, ADGRL3, CD81, BRINP3, CSMD3, XKR4, SNX22, OPHN1, SPATA6, TNK2, NRCAM, NCAM12, AL445250.1, ASIC4, SGK1, ZBTB20, BCAN1, SNTG1, DOCK10, ASTN2, FERMT1, SH3D19, PHLPP1, CMYA5, MMP16, LHFPL3, GRID2, PID1, CCDC50, PTN1, KIF13A, NAV2, DCC, PDE4B, CHD7, LRRC4C, COL9A1, OPCML, SLC22A171, NLGN4X, TMEM132C, ZSWIM6, SGCD, PTPRZ12, PPP1R9A, VCAN, NPAS3, GRIK1, CPE2, CHST11, QKI, CASK, AL353784.1, SEMA5A, ADARB2, SHISA9, STK32A, SERPINE2, GPR17, DPP6, GRM7, DGKG, WWOX, TMBIM6, OLIG1, CTTNBP2, HTRA1, PDGFRA, RP11-161M6.21, KIF26B, FCHSD2, NRCAM5, PCDH15, APBB2, CSMD1, COL16A11, SMOC1, SOX2-OT, LRP1, DSCAML1, PRKCA, ZEB1, C1orf612, KAZN, NOVA1-AS1, EPN2, C10orf11, MT32, SCN1A, PTPRZ1, NOVA1, CST32, REV3L, TAOK3, NCAM1, RP4-668E10.4, NTM, SEZ6L, OPC, CDH20, TNR, NRXN1, BCAS12, RPL13, C1orf61, PDZD2, NLGN1, PEAK1, MAML2, SDC3, DSCAM, PDZRN4, KAT2B, TCF12, NCKAP5, KCNQ1OT1, NAV1, LHFPL3-AS1, BCAS1, NAALADL2, MARCKS, BCAN, KCNMB2-AS1, KCND2, NCAM2, SCD5, CHL1, RP11-436D23.1, XYLT1, ITPR2, OLIG2, LRP1B, ABHD2, CSMD2"
Per,"UTRN, MYO1B, COLEC12, UACA, PDE7B, SLC6A12, TJP1, SLC1A3, GRM3, DCN, PTPRK, TXNIP, PPFIBP1, NEAT1, PTEN, B2M, NFIA, SLC19A1, Per, RBMS3, PTN, APBB2, COBLL1, ARHGAP29, INPP4B, ZEB1, LAMA2, GPC5, LPP, CYTH3, DLC1, PARD3, PDGFRB, NR2F2-AS1, SLC6A1, ITIH5, TACC1, IGFBP7, SLC38A11, PDE8B, PRKG1, ZBTB20, LHFP, ATP1A2, ADAMTS9-AS2, NTRK3, PDZD2, GRM8, RP11-649A16.1, HIGD1B, RORA, DDX17, DLEU2, SASH1, KIAA1109, EPS8, PTPRG, HSP90AA1, PTGDS, CALD1, EPAS1, EBF1, SLC20A2, NOTCH3, TTC17"
